{
  "dcp_version": "1.0",
  "agent_id": "did:agent:agent123",
  "public_key": "ywFRKbf3N5DA6UetOjCjfGBNyOSuXtr0THTqRA9V0+g=",
  "principal_binding_reference": "did:human:alice123",
  "capabilities": [
    "browse",
    "email",
    "api_call"
  ],
  "risk_tier": "medium",
  "created_at": "2026-01-01T00:10:00Z",
  "status": "active",
  "signature": "1S/uJm+yLpPSOdd+sEXt5MlBuYZvqr5SKQnhNWzEbpkfLqXGWklScblEpkKAjpxCeWVm/2Kc/C+PIzmbo4hTAQ=="
}